{
    "mode_id": "MY_QUOTE",
    "display_name": "自定义语录",
    "icon": "book",
    "cacheable": true,
    "description": "自定义语录模式",
    "content": {
      "type": "llm_json",
      "prompt_template": "请生成一条有深度的语录，用 JSON 返回 {quote, author}。{context}",
      "output_schema": {
        "quote": {
          "type": "string"
        },
        "author": {
          "type": "string"
        }
      },
      "temperature": 0.8,
      "fallback": {
        "quote": "路漫漫其修远兮",
        "author": "屈原"
      }
    },
    "layout": {
      "status_bar": {
        "line_width": 1
      },
      "body": [
        {
          "type": "centered_text",
          "field": "quote",
          "font_size": 18,
          "vertical_center": true
        }
      ],
      "footer": {
        "label": "MY_QUOTE",
        "attribution_template": "— {author}"
      }
    }
  }