{
  "mode_id": "ZEN",
  "display_name": "禅意",
  "icon": "zen",
  "cacheable": true,
  "description": "极简汉字与意境注释",

  "content": {
    "type": "llm_json",
    "prompt_template": "你是一位禅宗大师。选择一个最适合当下环境的汉字，并说明为什么选这个字。\n用 JSON 输出：{{\"word\": \"一个汉字\", \"source\": \"出处或意境说明（10字以内）\"}}\n如：{{\"word\": \"渡\", \"source\": \"苦海无边，回头是岸\"}}\n只输出一个字和一句意境说明，不要其他内容。\n环境：{context}",
    "output_schema": {
      "word": { "type": "string", "default": "静" },
      "source": { "type": "string", "default": "万物归寂" }
    },
    "post_process": { "word": "first_char" },
    "temperature": 0.8,
    "fallback": {
      "word": "静"
    },
    "fallback_pool": [
      {"word": "静"},
      {"word": "空"},
      {"word": "悟"},
      {"word": "定"},
      {"word": "舍"}
    ]
  },

  "layout": {
    "status_bar": { "line_width": 1, "dashed": true },
    "body": [
      {
        "type": "centered_text",
        "field": "word",
        "font": "noto_serif_regular",
        "font_size": 96,
        "max_width_ratio": 0.7,
        "vertical_center": true
      },
      {
        "type": "text",
        "field": "source",
        "font": "noto_serif_light",
        "font_size": 9,
        "align": "center",
        "max_lines": 1
      }
    ],
    "footer": {
      "label": "ZEN",
      "attribution_template": "— ...",
      "dashed": true
    }
  }
}
